{
  "schema_version": "bne-ro-field-request/v1.0.0",
  "session_id": "session-demo-3d",
  "representation": "sampled_grid",
  "domain": {
    "domain_kind": "axis_aligned_log_box",
    "coordinate_space": "dimensionless_log_ratio",
    "log_basis": "log10",
    "axis_order": ["input_a", "input_b", "input_c"],
    "axes": [
      {
        "axis_id": "input_a",
        "symbol": "tA",
        "coordinate_kind": "conserved_total",
        "orientation": "increasing_physical_value",
        "reference": { "value": 1.0, "unit": "uM" },
        "bounds": { "lower": -0.1, "upper": 0.1 }
      },
      {
        "axis_id": "input_b",
        "symbol": "tB",
        "coordinate_kind": "conserved_total",
        "orientation": "increasing_physical_value",
        "reference": { "value": 1.0, "unit": "uM" },
        "bounds": { "lower": -0.1, "upper": 0.1 }
      },
      {
        "axis_id": "input_c",
        "symbol": "tC",
        "coordinate_kind": "conserved_total",
        "orientation": "increasing_physical_value",
        "reference": { "value": 1.0, "unit": "uM" },
        "bounds": { "lower": -0.1, "upper": 0.1 }
      }
    ],
    "fixed_background": []
  },
  "outputs": {
    "output_order": ["output_x"],
    "items": [
      {
        "output_id": "output_x",
        "symbol": "x",
        "observable_kind": "species_concentration",
        "reference": { "value": 1.0, "unit": "uM" }
      }
    ]
  },
  "sampling": {
    "scheme": "cartesian_product",
    "axis_coordinates": [[-0.1, 0.1], [-0.1, 0.1], [-0.1, 0.1]]
  },
  "work_budget": {
    "work_unit_kind": "solver_samples",
    "max_evaluated_items": 8,
    "max_stored_items": 8,
    "max_payload_bytes": 1048576,
    "deadline_seconds": null
  },
  "storage": { "mode": "artifact_reference" }
}
