{
  "schema_version": "bne-ro-field-request/v1.0.0",
  "network": {
    "ir_schema_version": "bne-ir/v1.0.0",
    "label": "heterodimer-request-fixture",
    "species": [
      { "name": "A", "role": "free" },
      { "name": "B", "role": "free" },
      { "name": "AB", "role": "complex" }
    ],
    "reactions": [
      { "formula": "A + B <-> AB", "kd": 1.0, "kind": "binding", "reversible": true }
    ],
    "observables": [],
    "parameter_distributions": [],
    "compartments": [],
    "provenance": { "source": "contract-fixture" },
    "extensions": {}
  },
  "representation": "sampled_grid",
  "domain": {
    "domain_kind": "axis_aligned_log_box",
    "coordinate_space": "dimensionless_log_ratio",
    "log_basis": "log10",
    "axis_order": ["input_a", "input_b"],
    "axes": [
      {
        "axis_id": "input_a",
        "symbol": "tA",
        "coordinate_kind": "conserved_total",
        "orientation": "increasing_physical_value",
        "reference": { "value": 1.0, "unit": "uM" },
        "bounds": { "lower": -1.0, "upper": 1.0 }
      },
      {
        "axis_id": "input_b",
        "symbol": "tB",
        "coordinate_kind": "conserved_total",
        "orientation": "increasing_physical_value",
        "reference": { "value": 1.0, "unit": "uM" },
        "bounds": { "lower": -1.0, "upper": 1.0 }
      }
    ],
    "fixed_background": [
      {
        "parameter_id": "kd_ab",
        "symbol": "Kd1",
        "coordinate_kind": "binding_constant",
        "reference": { "value": 1.0, "unit": "uM" },
        "log_value": 0.0
      }
    ]
  },
  "outputs": {
    "output_order": ["output_ab"],
    "items": [
      {
        "output_id": "output_ab",
        "symbol": "AB",
        "observable_kind": "species_concentration",
        "reference": { "value": 1.0, "unit": "uM" }
      }
    ]
  },
  "sampling": {
    "scheme": "cartesian_product",
    "axis_coordinates": [[-1.0, 0.0, 1.0], [-1.0, 0.0, 1.0]]
  },
  "work_budget": {
    "work_unit_kind": "solver_samples",
    "max_evaluated_items": 9,
    "max_stored_items": 9,
    "max_payload_bytes": 1048576,
    "deadline_seconds": 10.0
  },
  "storage": { "mode": "inline" }
}
